author,quote
Babe Ruth,"The way a team plays as a whole determines its success. You may have the greatest bunch of individual stars in the world, but if they don't play together, the club won't be worth a dime."
Bob Feller,"Every day is a new opportunity. You can build on yesterday's success or put its failures behind and start over again. That's the way life is, with a new game every day, and that's the way baseball is."
Rodney Dangerfield,"I went to a fight the other night, and a hockey game broke out."
Bobby Unser,Success is where preparation and opportunity meet.
Mark Twain,Golf is a good walk spoiled.
William Arthur Ward,Adversity causes some men to break; others to break records.
Satchel Paige,Don't look back. Something might be gaining on you.
Swami Vivekananda,"Take up one idea. Make that one idea your life - think of it, dream of it, live on that idea. Let the brain, muscles, nerves, every part of your body, be full of that idea, and just leave every other idea alone. This is the way to success."
Booker T. Washington,Success is to be measured not so much by the position that one has reached in life as by the obstacles which he has overcome.
Stephen Hawking,"However difficult life may seem, there is always something you can do and succeed at."
Pablo Picasso,Action is the foundational key to all success.
Franklin D. Roosevelt,Happiness lies in the joy of achievement and the thrill of creative effort.
Sophocles,Success is dependent on effort.
A. P. J. Abdul Kalam,Man needs his difficulties because they are necessary to enjoy success.
John Wooden,Success is peace of mind which is a direct result of self-satisfaction in knowing you did your best to become the best you are capable of becoming.
George S. Patton,Success is how high you bounce when you hit bottom.
Jim Rohn,Formal education will make you a living; self-education will make you a fortune.
Abraham Lincoln,Always bear in mind that your own resolution to succeed is more important than any other.
John Ruskin,"When love and skill work together, expect a masterpiece."
Jim Lovell,"There are people who make things happen, there are people who watch things happen, and there are people who wonder what happened. To be successful, you need to be a person who makes things happen."
Sun Tzu,Invincibility lies in the defence; the possibility of victory in the attack.
Elbert Hubbard,"He has achieved success who has worked well, laughed often, and loved much."
Zig Ziglar,"The foundation stones for a balanced success are honesty, character, integrity, faith, love and loyalty."
David Frost,"Don't aim for success if you want it; just do what you love and believe in, and it will come naturally."
Mario Andretti,"Desire is the key to motivation, but it's determination and commitment to an unrelenting pursuit of your goal - a commitment to excellence - that will enable you to attain the success you seek."
Mike Ditka,Success isn't measured by money or power or social rank. Success is measured by your discipline and inner peace.
William Penn,"Time is what we want most, but what we use worst."
John Lennon,"Time you enjoy wasting, was not wasted."
M. Scott Peck,"Until you value yourself, you won't value your time. Until you value your time, you will not do anything with it."
Horace Mann,"Lost - yesterday, somewhere between sunrise and sunset, two golden hours, each set with sixty diamond minutes. No reward is offered, for they are gone forever."
Charles M. Schulz,Don't worry about the world coming to an end today. It is already tomorrow in Australia.
John Wanamaker,People who cannot find time for recreation are obliged sooner or later to find time for illness.
Leonardo da Vinci,Time stays long enough for anyone who will use it.
Mary Kay Ash,"No matter how busy you are, you must take time to make the other person feel important."
C. S. Lewis,"The future is something which everyone reaches at the rate of 60 minutes an hour, whatever he does, whoever he is."
Jean Racine,There are no secrets that time does not reveal.
Delmore Schwartz,"Time is the school in which we learn, time is the fire in which we burn."
Charles Caleb Colton,The present time has one advantage over every other - it is our own.
Barbara Bush,"At the end of your life, you will never regret not having passed one more test, not winning one more verdict or not closing one more deal. You will regret time not spent with a husband, a friend, a child, or a parent."
Ray Bradbury,Living at risk is jumping off the cliff and building your wings on the way down.
Corazon Aquino,"I just do whatever it is that I believe I should do, regardless of the risks to my life."
Franz Liszt,Beware of missing chances; otherwise it may be altogether too late some day.
Henry James,The right time is any time that one is still so lucky as to have.
Herodotus,Great deeds are usually wrought at great risks.
John Paul Jones,"It seems to be a law of nature, inflexible and inexorable, that those who will not risk cannot win."
Charles Kettering,"Keep on going and the chances are you will stumble on something, perhaps when you are least expecting it. I have never heard of anyone stumbling on something sitting down."
James A. Garfield,A pound of pluck is worth a ton of luck.
Cat Cora,"Even when you have doubts, take that step. Take chances. Mistakes are never a failure - they can be turned into wisdom."
F. Scott Fitzgerald,Nothing is as obnoxious as other people's luck.
Waylon Jennings,Don't ever try and be like anybody else and don't be afraid to take risks.
Margaret J. Wheatley,"Determination, energy, and courage appear spontaneously when we care deeply about something. We take risks that are unimaginable in any other context."
Chuck Yeager,You don't concentrate on risks. You concentrate on results. No risk is too great to prevent the necessary job from getting done.
Dave Thomas,"I think the harder you work, the more luck you have."
Dick Cavett,"If your parents never had children, chances are you won't either."
Werner Herzog,"I prefer to be alive, so I'm cautious about taking risks."
Mark Russell,The scientific theory I like best is that the rings of Saturn are composed entirely of lost airline luggage.
Tom Hanks,You cannot look up at the night sky on the Planet Earth and not wonder what it's like to be up there amongst the stars. And I always look up at the moon and see it as the single most romantic place within the cosmos.
William Blake,"If the Sun and Moon should ever doubt, they'd immediately go out."
Peter Diamandis,Space is an inspirational concept that allows you to dream big.
Henry David Thoreau,What is the use of a house if you haven't got a tolerable planet to put it on?
Mignon McLaughlin,"We all become great explorers during our first few days in a new city, or a new love affair."
Nikos Kazantzakis,Every perfect traveler always creates the country where he travels.
William Hazlitt,A wise traveler never despises his own country.
Francis Bacon,"Travel, in the younger sort, is a part of education; in the elder, a part of experience."
Dick Van Dyke,Women will never be as successful as men because they have no wives to advise them.
Arthur Conan Doyle,"Women are naturally secretive, and they like to do their own secreting."
Frank Sinatra,"I like intelligent women. When you go out, it shouldn't be a staring contest."
Emma Goldman,Women need not always keep their mouths shut and their wombs open.
Yul Brynner,"Girls have an unfair advantage over men: if they can't get what they want by being smart, they can get it by being dumb."
Bill Maher,Women cannot complain about men anymore until they start getting better taste in them.
Robert Frost,Being the boss anywhere is lonely. Being a female boss in a world of mostly men is especially so.
Marlene Dietrich,"Most women set out to try to change a man, and when they have changed him they do not like him."
Jane Austen,Single women have a dreadful propensity for being poor. Which is one very strong argument in favor of matrimony.
John F. Kennedy,"The cost of freedom is always high, but Americans have always paid it. And one path we shall never choose, and that is the path of surrender, or submission."
Dave Barry,"To an adolescent, there is nothing in the world more embarrassing than a parent."
Nigella Lawson,"I was a quiet teenager, introverted, full of angst."
Laurence J. Peter,Heredity is what sets the parents of a teenager wondering about each other.
John Knowles,Teenagers today are more free to be themselves and to accept themselves.
Jim Bishop,"Nobody understands anyone 18, including those who are 18."
Enrique Iglesias,"I wouldn't change anything. I've made mistakes, but thanks to those mistakes, I've learned."
Jim Lovell,"Be thankful for problems. If they were less difficult, someone with less ability might have your job."
Robert Louis Stevenson,Keep your eyes open to your mercies. The man who forgets to be thankful has fallen asleep in life.
Elizabeth I,"I do not so much rejoice that God hath made me to be a Queen, as to be a Queen over so thankful a people."
Srikumar Rao,"I believe that if you don't derive a deep sense of purpose from what you do, if you don't come radiantly alive several times a day, if you don't feel deeply grateful at the tremendous good fortune that has been bestowed on you, then you are wasting your life. And life is too short to waste."
Margaret Mead,"Thanks to television, for the first time the young are seeing history made before it is censored by their elders."
Eric Hoffer,The hardest arithmetic to master is that which enables us to count our blessings.
Suze Orman,When you are grateful - when you can see what you have - you unlock blessings to flow in your life.
Jake Owen,"I was given such a great gift. It's a miracle that never stops amazing me and reminding me to give thanks, every day. Having a wife and daughter gives me a lot more purpose. I was much more selfish before, but now I think about what kind of role model I'll be. I just want to be a better man."
Saint Basil,Does not the gratitude of the dog put to shame any man who is ungrateful to his benefactors?
William Bennett,Sometimes we need to remind ourselves that thankfulness is indeed a virtue.
Rod Stewart,"Well, there's not a day goes by when I don't get up and say thank you to somebody."
Jean-Jacques Rousseau,"Gratitude is a duty which ought to be paid, but which none have a right to expect."
Garrison Keillor,"Thank you, dear God, for this good life and forgive us if we do not love it enough. Thank you for the rain. And for the chance to wake up in three hours and go fishing: I thank you for that now, because I won't feel so thankful then."
Freeman Dyson,"Technology is a gift of God. After the gift of life it is perhaps the greatest of God's gifts. It is the mother of civilizations, of arts and of sciences."
Henry David Thoreau,Men have become the tools of their tools.
Carrie Snow,"Technology... is a queer thing. It brings you great gifts with one hand, and it stabs you in the back with the other."
Scott Cook,We're still in the first minutes of the first day of the Internet revolution.
Max Frisch,Technology is the knack of so arranging the world that we don't have to experience it.
Jimmy Carter,"Globalization, as defined by rich people like us, is a very nice thing... you are talking about the Internet, you are talking about cell phones, you are talking about computers. This doesn't affect two-thirds of the people of the world."
George Lucas,"The technology keeps moving forward, which makes it easier for the artists to tell their stories and paint the pictures they want."
Linus Torvalds,"The Linux philosophy is 'Laugh in the face of danger'. Oops. Wrong One. 'Do it yourself'. Yes, that's it."
Alvin Toffler,"Our technological powers increase, but the side effects and potential hazards also escalate."
Dave Barry,The Internet is the most important single development in the history of human communication since the invention of call waiting.
Esai Morales,I love bringing roses to a woman when she least expects it.
Drew Barrymore,I love romance. I'm a sucker for it. I love it so much. It's pathetic.
Susie Bright,I'm like the kid in kindergarten; I really do send valentines to everyone.
Elizabeth Bowen,When you love someone all your saved up wishes start coming out.
Ginnifer Goodwin,"I love Valentine's Day! I love it, I love it, I love it. I like having doors opened for me. My favorite romantic comedy is 'When Harry Met Sally.'"
Chris Evans,"I think diamonds represent luxury, indulgence, and class. So any time you can incorporate a gift that is synonymous with all those attributes, you know the other person will love it. I would challenge someone to find something that better represents Valentine's Day more than diamonds!"
Katya Zamolodchikova,"I love love. Every day of my life is Valentine's Day. When you're a pathological narcissist, you have to fall in love with yourself every day."
Amy Morin,"One of the major dangers of being alone in February is the tendency to dwell on past relationships. Whether you're daydreaming about that 'one that got away,' or you're recalling the fairy tale date you went on last Valentine's Day, romanticizing the past isn't helpful - nor accurate."
Jawed Karim,That's one of those things about being a computer science major: Valentine's Day is just another day.
Dan Levy,"Valentine's Day is one of those tricky celebrations where you're damned if you do and damned if you don't. If you love it, you're buying into a holiday created to sell greeting cards, bad bouquets, and shoddy love-themed stuffed animals. And if you're opposed to it, you're considered lonely and single and have clearly never had a valentine."
Evangeline Lilly,"When I got old enough to date, I realized that Valentine's Day is just a commercial marketing scam to make men feel bad. So I let my boyfriends off the hook."
Solon,Put more trust in nobility of character than in an oath.
Robert Baden-Powell,Trust should be the basis for all our moral training.
Shelley Long,Not everyone can be trusted. I think we all have to be very selective about the people we trust.
Virgil,Trust not too much to appearances.
Charles Kingsley,"A blessed thing it is for any man or woman to have a friend, one human soul whom we can trust utterly, who knows the best and worst of us, and who loves us in spite of all our faults."
Rollo May,"The opposite of courage in our society is not cowardice, it is conformity."
J. R. R. Tolkien,Courage is found in unlikely places.
Norman Schwarzkopf,"True courage is being afraid, and going ahead and doing your job anyhow, that's what courage is."
Victor Hugo,"Have courage for the great sorrows of life and patience for the small ones; and when you have laboriously accomplished your daily task, go to sleep in peace."
Coco Chanel,The most courageous act is still to think for yourself. Aloud.
Henri Matisse,Creativity takes courage.
Ray Kurzweil,"Supercomputers will achieve one human brain capacity by 2010, and personal computers will do so by about 2020."
Issey Miyake,"Even when I work with computers, with high technology, I always try to put in the touch of the hand."
Stephen R. George,"I got up with my wife, I sat down at the computer when she went to work, and I didn't stop until she got home."
Laurence Sterne,"Respect for ourselves guides our morals, respect for others guides our manners."
Lao Tzu,"When you are content to be simply yourself and don't compare or compete, everybody will respect you."
Voltaire,"To the living we owe respect, but to the dead we owe only the truth."
Albert Camus,"I would rather live my life as if there is a God and die to find out there isn't, than live as if there isn't and to die to find out that there is."
Desmond Tutu,When the missionaries came to Africa they had the Bible and we had the land. They said 'Let us pray.' We closed our eyes. When we opened them we had the Bible and they had the land.
Lucius Annaeus Seneca,"Religion is regarded by the common people as true, by the wise as false, and by the rulers as useful."
Napoleon Bonaparte,Religion is what keeps the poor from murdering the rich.
Jesus Christ,"So I say to you, Ask and it will be given to you; search, and you will find; knock, and the door will be opened for you."
Thomas Paine,"The World is my country, all mankind are my brethren, and to do good is my religion."
C. S. Lewis,Aim at heaven and you will get earth thrown in. Aim at earth and you get neither.
Abraham Lincoln,"When I do good I feel good, when I do bad I feel bad, and that's my religion."
Swami Vivekananda,You cannot believe in God until you believe in yourself.
Henry David Thoreau,Heaven is under our feet as well as over our heads.
Frederick Douglass,I prayed for twenty years but received no answer until I prayed with my legs.
Buddha,"Just as a candle cannot burn without fire, men cannot live without a spiritual life."
Maya Angelou,"When someone shows you who they are, believe them the first time."
Bob Marley,Truth is everybody is going to hurt you: you just gotta find the ones worth suffering for.
Rollo May,Care is a state in which something does matter; it is the source of human tenderness.
Walter Winchell,Never above you. Never below you. Always beside you.
Richard Bach,"If you love someone, set them free. If they come back they're yours; if they don't they never were."
Elon Musk,I think it matters whether someone has a good heart.
Wayne Dyer,How people treat you is their karma; how you react is yours.
Oscar Wilde,"Between men and women there is no friendship possible. There is passion, enmity, worship, love, but no friendship."
Jean de La Fontaine,By the work one knows the workman.
Peter Abelard,"By doubting we are led to question, by questioning we arrive at the truth."
Anne Lamott,"Your problem is how you are going to spend this one odd and precious life you have been issued. Whether you're going to spend it trying to look good and creating the illusion that you have power over people and circumstances, or whether you are going to taste it, enjoy it and find out the truth about who you are."
Rene Descartes,"If you would be a real seeker after truth, it is necessary that at least once in your life you doubt, as far as possible, all things."
Hunter S. Thompson,"In a closed society where everybody's guilty, the only crime is getting caught. In a world of thieves, the only final sin is stupidity."
Pope John Paul II,"Love is never defeated, and I could add, the history of Ireland proves it."
Darrell Royal,"You've got to think lucky. If you fall into a mudhole, check your back pocket - you might have caught a fish."
Brendan Behan,"If it was raining soup, the Irish would go out with forks."
John Millington Synge,There is no language like the Irish for soothing and quieting.
Joseph Brodsky,Cherish your human connections: your relationships with friends and family.
Bruce Lee,"Knowledge will give you power, but character respect."
Edmund Burke,"The greater the power, the more dangerous the abuse."
Lao Tzu,Mastering others is strength. Mastering yourself is true power.
William Gaddis,"Power doesn't corrupt people, people corrupt power."
William Blake,Excessive sorrow laughs. Excessive joy weeps.
Cristiano Ronaldo,"When you lose a person you love so much, surviving the loss is difficult."
Meister Eckhart,"Truly, it is in darkness that one finds the light, so when we are in sorrow, then this light is nearest of all to us."
Robert Southey,"The loss of a friend is like that of a limb; time may heal the anguish of the wound, but the loss cannot be repaired."
Lord Byron,The dew of compassion is a tear.
Willie Nelson,"Once you replace negative thoughts with positive ones, you'll start having positive results."
Lyndon B. Johnson,"Yesterday is not ours to recover, but tomorrow is ours to win or lose."
Helen Keller,Keep your face to the sunshine and you cannot see a shadow.
Matt Cameron,"Live life to the fullest, and focus on the positive."
Martha Beck,Every day brings new choices.
Kobe Bryant,The most important thing is to try and inspire people so that they can be great in whatever they want to do.
Leah LaBelle,"Work hard for what you want because it won't come to you without a fight. You have to be strong and courageous and know that you can do anything you put your mind to. If somebody puts you down or criticizes you, just keep on believing in yourself and turn it into something positive."
Plato,One of the penalties for refusing to participate in politics is that you end up being governed by your inferiors.
Dante Alighieri,The darkest places in hell are reserved for those who maintain their neutrality in times of moral crisis.
Thomas Paine,"The real man smiles in trouble, gathers strength from distress, and grows brave by reflection."
Phyllis Diller,A smile is a curve that sets everything straight.
Lord Byron,"Be thou the rainbow in the storms of life. The evening beam that smiles the clouds away, and tints tomorrow with prophetic ray."
Walter Scott,"Look back, and smile on perils past."
Yoko Ono,Smile in the mirror. Do that every morning and you'll start to see a big difference in your life.
Tom Wilson,A smile is happiness you'll find right under your nose.
Rashida Jones,"Smiling is definitely one of the best beauty remedies. If you have a good sense of humor and a good approach to life, that's beautiful."
William Hazlitt,"A gentle word, a kind look, a good-natured smile can work wonders and accomplish miracles."
Serena Williams,"I'm really exciting. I smile a lot, I win a lot, and I'm really sexy."
Jimmy Buffett,Wrinkles will only go where the smiles have been.
Emily Dickinson,They might not need me; but they might. I'll let my head be just in sight; a smile as small as mine might be precisely their necessity.
Aristotle,The one exclusive sign of thorough knowledge is the power of teaching.
Temple Grandin,I cannot emphasize enough the importance of a good teacher.
Gilbert Highet,A good teacher is a determined person.
Dan Rather,"The dream begins with a teacher who believes in you, who tugs and pushes and leads you to the next plateau, sometimes poking you with a sharp stick called 'truth'."
Soren Kierkegaard,Take away paradox from the thinker and you have a professor.
Mahatma Gandhi,Those who know how to think need no teachers.
Harry S Truman,I do not believe there is a problem in this country or the world today which could not be settled if approached through the teaching of the Sermon on the Mount.
Guy Kawasaki,"If you have to put someone on a pedestal, put teachers. They are society's heroes."
Thucydides,History is Philosophy teaching by example.
Arthur M. Schlesinger,"Science and technology revolutionize our lives, but memory, tradition and myth frame our response."
Jeff Bezos,The human brain is an incredible pattern-matching machine.
Will Harvey,What is research but a blind date with knowledge?
Sally Ride,Science is fun. Science is curiosity. We all have natural curiosity. Science is a process of investigating. It's posing questions and coming up with a method. It's delving in.
Adam Smith,Science is the great antidote to the poison of enthusiasm and superstition.
Neil Armstrong,Geologists have a saying - rocks remember.
Plato,Science is nothing but perception.
Arnold H. Glasow,"The fewer the facts, the stronger the opinion."
Stephen Hawking,"Science is not only a disciple of reason but, also, one of romance and passion."
Ralph Waldo Emerson,Science does not know its debt to imagination.
Robert Green Ingersoll,"Reason, observation, and experience; the holy trinity of science."
Arthur C. Clarke,"If an elderly but distinguished scientist says that something is possible, he is almost certainly right; but if he says that it is impossible, he is very probably wrong."
Mary Kay Ash,"Aerodynamically, the bumble bee shouldn't be able to fly, but the bumble bee doesn't know it so it goes on flying anyway."
Charles Spurgeon,"Anxiety does not empty tomorrow of its sorrows, but only empties today of its strength."
Saint Francis de Sales,"Nothing is so strong as gentleness, nothing so gentle as real strength."
Hermann Hesse,Some of us think holding on makes us strong; but sometimes it is letting go.
Leonardo da Vinci,Tears come from the heart and not from the brain.
Henry David Thoreau,"Make the most of your regrets; never smother your sorrow, but tend and cherish it till it comes to have a separate and integral interest. To regret deeply is to live afresh."
John Greenleaf Whittier,"For all sad words of tongue and pen, The saddest are these, 'It might have been'."
Richie Sambora,"I've spent a lot of Thanksgivings on the road with my band, so anytime that I can spend Thanksgiving with my family in a traditional aspect, eating sweet potatoes and cranberries and stuffing and all the trappings of Thanksgiving and then get on a treadmill the next day extra long, I'm happy."
Ina Garten,"If you think about a Thanksgiving dinner, it's really like making a large chicken."
O. Henry,There is one day that is ours. Thanksgiving Day is the one day that is purely American.
Todd Barry,I love chicken. I would eat chicken fingers on Thanksgiving if it were socially acceptable.
Kin Hubbard,A lot of Thanksgiving days have been ruined by not carving the turkey in the kitchen.
Douglas Conant,"My most memorable meal is every Thanksgiving. I love the food: the turkey and stuffing; the sweet potatoes and rice, which come from my mother's Southern heritage; the mashed potatoes, which come from my wife's Midwestern roots; the Campbell's green-bean casserole; and of course, pumpkin pie."
Michael Strahan,That's one of the great things about Thanksgiving: Football's on!
Franz Grillparzer,"Drink and be thankful to the host! What seems insignificant when you have it, is important when you need it."
Lewis Black,"When people come to my act any time after Thanksgiving, I usually say, You shouldn't be here. You should be shopping. Our economy depends on you! You should be out there buying stuff.'"
