author,quote
Margaret Mead,"Never doubt that a small group of thoughtful, committed citizens can change the world; indeed, it's the only thing that ever has."
Ban Ki-moon,"Saving our planet, lifting people out of poverty, advancing economic growth... these are one and the same fight. We must connect the dots between climate change, water scarcity, energy shortages, global health, food security and women's empowerment. Solutions to one problem must be solutions for all."
Richard Rogers,"The only way forward, if we are going to improve the quality of the environment, is to get everybody involved."
Albert Einstein,The environment is everything that isn't me.
Dennis Weaver,We don't have to sacrifice a strong economy for a healthy environment.
Elon Musk,"We're running the most dangerous experiment in history right now, which is to see how much carbon dioxide the atmosphere... can handle before there is an environmental catastrophe."
Evo Morales,"Sooner or later, we will have to recognise that the Earth has rights, too, to live without pollution. What mankind must know is that human beings cannot live without Mother Earth, but the planet can live without humans."
Barry Commoner,Environmental pollution is an incurable disease. It can only be prevented.
Jacques Yves Cousteau,"Water and air, the two essential fluids on which all life depends, have become global garbage cans."
John Muir,"Keep close to Nature's heart... and break clear away, once in awhile, and climb a mountain or spend a week in the woods. Wash your spirit clean."
Chief Seattle,The Earth does not belong to us: we belong to the Earth.
Bill Gates,"Climate change is a terrible problem, and it absolutely needs to be solved. It deserves to be a huge priority."
Sidney Sheldon,Try to leave the Earth a better place than when you arrived.
Henry David Thoreau,"Thank God men cannot fly, and lay waste the sky as well as the earth."
Bill Nye,"Climate change is happening, humans are causing it, and I think this is perhaps the most serious environmental issue facing us."
Mike Huckabee,"The most important thing about global warming is this. Whether humans are responsible for the bulk of climate change is going to be left to the scientists, but it's all of our responsibility to leave this planet in better shape for the future generations than we found it."
Carlos Ghosn,The time is right for electric cars - in fact the time is critical.
E. O. Wilson,"If all mankind were to disappear, the world would regenerate back to the rich state of equilibrium that existed ten thousand years ago. If insects were to vanish, the environment would collapse into chaos."
Bob Brown,The future will either be green or not at all.
Kurt Vonnegut,We could have saved the Earth but we were too damned cheap.
Unknown,"A true conservationist is a man who knows that the world is not given by his fathers, but borrowed from his children."
Annie Dillard,There is a muscular energy in sunlight corresponding to the spiritual energy of wind.
Stewart Udall,"Plans to protect air and water, wilderness and wildlife are in fact plans to protect man."
Alex Trebek,"If you can't be in awe of Mother Nature, there's something wrong with you."
Leonardo DiCaprio,Raising awareness on the most pressing environmental issues of our time is more important than ever.
Aeschylus,By polluting clear water with slime you will never find good drinking water.
Ansel Adams,It is horrifying that we have to fight our own government to save the environment.
Aldo Leopold,Conservation is a state of harmony between men and land.
William Inge,"We have enslaved the rest of the animal creation, and have treated our distant cousins in fur and feathers so badly that beyond doubt, if they were able to formulate a religion, they would depict the Devil in human form."
Yoko Ono,Every drop in the ocean counts.
Isaac Bashevis Singer,"I did not become a vegetarian for my health, I did it for the health of the chickens."
O. Henry,"We may achieve climate, but weather is thrust upon us."
Michael C. Burgess,Nuclear power will help provide the electricity that our growing economy needs without increasing emissions. This is truly an environmentally responsible source of energy.
Sitting Bull,"They claim this mother of ours, the Earth, for their own use, and fence their neighbors away from her, and deface her with their buildings and their refuse."
Roger Tory Peterson,"Birds are indicators of the environment. If they are in trouble, we know we'll soon be in trouble."
Anna Freud,"We are aware only of the empty space in the forest, which only yesterday was filled with trees."
Lindsey Graham,"The sooner we get started with alternative energy sources and recognize that fossil fuels makes us less secure as a nation, and more dangerous as a planet, the better off we'll be."
Paul Hawken,All is connected... no one thing can change by itself.
James Lovelock,"Sadly, it's much easier to create a desert than a forest."
Peter Diamandis,"We live in a world bathed in 5,000 times more energy than we consume as a species in the year, in the form of solar energy. It's just not in usable form yet."
Tom Allen,Energy conservation is the foundation of energy independence.
Wangari Maathai,"In a few decades, the relationship between the environment, resources and conflict may seem almost as obvious as the connection we see today between human rights, democracy and peace."
Jacob Bronowski,"You will die but the carbon will not; its career does not end with you. It will return to the soil, and there a plant may take it up again in time, sending it once more on a cycle of plant and animal life."
Christopher Dodd,We learned that economic growth and environmental protection can and should go hand in hand.
Madeleine M. Kunin,"When all the world appears to be in a tumult, and nature itself is feeling the assault of climate change, the seasons retain their essential rhythm. Yes, fall gives us a premonition of winter, but then, winter, will be forced to relent, once again, to the new beginnings of soft greens, longer light, and the sweet air of spring."
Sylvia Earle,"Ten percent of the big fish still remain. There are still some blue whales. There are still some krill in Antarctica. There are a few oysters in Chesapeake Bay. Half the coral reefs are still in pretty good shape, a jeweled belt around the middle of the planet. There's still time, but not a lot, to turn things around."
Al Gore,"Our world faces a true planetary emergency. I know the phrase sounds shrill, and I know it's a challenge to the moral imagination."
Dan Lipinski,"Yet, despite our many advances, our environment is still threatened by a range of problems, including global climate change, energy dependence on unsustainable fossil fuels, and loss of biodiversity."
Brooke Burke,I really believe in the environmental movement right now - it only takes a little effort to make a big difference.
Jim Clyburn,Environmental policy must strike a balance between the earth's best interests and our citizen's pressing needs.
John Doerr,Green-tech could be the largest economic opportunity of the 21st Century.
Elon Musk,"The reality is gas prices should be much more expensive then they are because we're not incorporating the true damage to the environment and the hidden costs of mining oil and transporting it to the U.S. Whenever you have an unpriced externality, you have a bit of a market failure, to the degree that eternality remains unpriced."
Joseph Wood Krutch,"If we do not permit the earth to produce beauty and joy, it will in the end not produce food, either."
Norm Dicks,The Endangered Species Act is the strongest and most effective tool we have to repair the environmental harm that is causing a species to decline.
Peter Benchley,Without the oceans there would be no life on Earth.
Pat Buckley,"I can find God in nature, in animals, in birds and the environment."
Freeman Dyson,"We have no reason to think that climate change is harmful if you look at the world as a whole. Most places, in fact, are better off being warmer than being colder. And historically, the really bad times for the environment and for people have been the cold periods rather than the warm periods."
Luther Burbank,We must return to nature and nature's god.
Vaclav Klaus,"Nevertheless, there is another threat on the horizon. I see this threat in environmentalism which is becoming a new dominant ideology, if not a religion. Its main weapon is raising the alarm and predicting the human life endangering climate change based on man-made global warming."
Russel Honore,People need to be cautious because anything built by man can be destroyed by Mother Nature.
Marcus Tullius Cicero,The life of the dead is placed in the memory of the living.
Benjamin Franklin,Some people die at 25 and aren't buried until 75.
Marcus Aurelius,"It is not death that a man should fear, but he should fear never beginning to live."
Mark Twain,The fear of death follows from the fear of life. A man who lives fully is prepared to die at any time.
George Eliot,"Our dead are never dead to us, until we have forgotten them."
"Martin Luther King, Jr.","If a man has not discovered something that he will die for, he isn't fit to live."
Ashley Montagu,The idea is to die young as late as possible.
Napoleon Bonaparte,"Death is nothing, but to live defeated and inglorious is to die daily."
Tecumseh,"When your time comes to die, be not like those whose hearts are filled with fear of death, so that when their time comes they weep and pray for a little more time to live their lives over again in a different way. Sing your death song, and die like a hero going home."
David Gerrold,Life is hard. Then you die. Then they throw dirt in your face. Then the worms eat you. Be grateful it happens in that order.
Albert Pike,What we have done for ourselves alone dies with us; what we have done for others and the world remains and is immortal.
Unknown,"Everybody wants to go to heaven, but nobody wants to die."
William Shakespeare,Cowards die many times before their deaths; the valiant never taste of death but once.
Thomas Babington Macaulay,"And how can man die better than facing fearful odds, for the ashes of his fathers, and the temples of his Gods?"
Lois McMaster Bujold,The dead cannot cry out for justice. It is a duty of the living to do so for them.
Corazon Aquino,I would rather die a meaningful death than to live a meaningless life.
Edvard Munch,"From my rotting body, flowers shall grow and I am in them and that is eternity."
Groucho Marx,"I intend to live forever, or die trying."
Horace Mann,Be ashamed to die until you have won some victory for humanity.
Woody Allen,"I am not afraid of death, I just don't want to be there when it happens."
Georges Bernanos,"Hell, madam, is to love no longer."
Bill Maher,"Suicide is man's way of telling God, 'You can't fire me - I quit.'"
Winston Churchill,I am prepared to meet my Maker. Whether my Maker is prepared for the great ordeal of meeting me is another matter.
J. Robert Oppenheimer,"I am become death, the destroyer of worlds."
Brian Clough,"Don't send me flowers when I'm dead. If you like me, send them while I'm alive."
Helen Keller,"Death is no more than passing from one room into another. But there's a difference for me, you know. Because in that other room I shall be able to see."
Clarence Darrow,"I have never killed a man, but I have read many obituaries with great pleasure."
Warren Zevon,I'll sleep when I'm dead.
Robert De Niro,You'll have time to rest when you're dead.
Virginia Woolf,Someone has to die in order that the rest of us should value life more.
Susan Ertz,Millions long for immortality who don't know what to do with themselves on a rainy Sunday afternoon.
Edgar Allan Poe,"The boundaries which divide Life from Death are at best shadowy and vague. Who shall say where the one ends, and where the other begins?"
Nelson Mandela,Education is the most powerful weapon which you can use to change the world.
Benjamin Franklin,An investment in knowledge pays the best interest.
Albert Einstein,I have no special talent. I am only passionately curious.
Mark Twain,"In the first place, God made idiots. That was for practice. Then he made school boards."
Abraham Lincoln,The philosophy of the school room in one generation will be the philosophy of government in the next.
Aristotle,It is the mark of an educated mind to be able to entertain a thought without accepting it.
John Dewey,Education is not preparation for life; education is life itself.
"Martin Luther King, Jr.",The function of education is to teach one to think intensively and to think critically. Intelligence plus character - that is the goal of true education.
Moliere,"We die only once, and for such a long time."
Henry Van Dyke,Some people are so afraid to die that they never begin to live.
Sitting Bull,"If we must die, we die defending our rights."
Eleanor Roosevelt,The future belongs to those who believe in the beauty of their dreams.
Colin Powell,"A dream doesn't become reality through magic; it takes sweat, determination and hard work."
Nicole Scherzinger,"I love a man with a great sense of humor and who is intelligent - a man who has a great smile. He has to make me laugh. I like a man who is very ambitious and driven and who has a good heart and makes me feel safe. I like a man who is very strong and independent and confident - that is very sexy - but at the same time, he's very kind to people."
William Butler Yeats,"Education is not the filling of a pail, but the lighting of a fire."
Anthony J. D'Angelo,"Develop a passion for learning. If you do, you will never cease to grow."
Diogenes,The foundation of every state is the education of its youth.
Theodore Roosevelt,To educate a man in mind and not in morals is to educate a menace to society.
Chanakya,Education is the best friend. An educated person is respected everywhere. Education beats the beauty and the youth.
Francis Bacon,"Men fear death as children fear to go in the dark; and as that natural fear in children is increased by tales, so is the other."
Maya Angelou,"If we lose love and self respect for each other, this is how we finally die."
Jean Cocteau,"Since the day of my birth, my death began its walk. It is walking toward me, without hurrying."
Mark Twain,"The only way to keep your health is to eat what you don't want, drink what you don't like, and do what you'd rather not."
Bethenny Frankel,Your diet is a bank account. Good food choices are good investments.
Louis C. K.,I don't stop eating when I'm full. The meal isn't over when I'm full. It's over when I hate myself.
Gene Tierney,"I followed the same diet for 20 years, eliminating starches, living on salads, lean meat, and small portions."
Linford Christie,Adopting a new healthier lifestyle can involve changing diet to include more fresh fruit and vegetables as well as increasing levels of exercise.
Tom Colicchio,"This is what people don't understand: obesity is a symptom of poverty. It's not a lifestyle choice where people are just eating and not exercising. It's because kids - and this is the problem with school lunch right now - are getting sugar, fat, empty calories - lots of calories - but no nutrition."
Amber Heard,You feel better when you're eating food that retains nutritional value.
Walt Disney,"All our dreams can come true, if we have the courage to pursue them."
A. P. J. Abdul Kalam,You have to dream before your dreams can come true.
Mitch Hedberg,I don't have a girlfriend. But I do know a woman who'd be mad at me for saying that.
William Shakespeare,"Good night, good night! Parting is such sweet sorrow, that I shall say good night till it be morrow."
Maya Angelou,Love is like a virus. It can happen to anybody at any time.
Wayne Dyer,Real magic in relationships means an absence of judgment of others.
George Washington Carver,Education is the key to unlock the golden door of freedom.
Maimonides,Give a man a fish and you feed him for a day; teach a man to fish and you feed him for a lifetime.
Allan Bloom,Education is the movement from darkness to light.
James Thurber,It is better to know some of the questions than all of the answers.
Herbert Spencer,The great aim of education is not knowledge but action.
Conrad Hall,"You are always a student, never a master. You have to keep moving forward."
Oscar Wilde,"Education is an admirable thing, but it is well to remember from time to time that nothing that is worth knowing can be taught."
Robert Frost,Education is the ability to listen to almost anything without losing your temper or your self-confidence.
Abigail Adams,"Learning is not attained by chance, it must be sought for with ardor and diligence."
Victor Hugo,"He who opens a school door, closes a prison."
Gilbert K. Chesterton,Education is simply the soul of a society as it passes from one generation to another.
Maya Angelou,"My mother said I must always be intolerant of ignorance but understanding of illiteracy. That some people, unable to go to school, were more educated and more intelligent than college professors."
Carl Rogers,The only person who is educated is the one who has learned how to learn and change.
Leonardo da Vinci,Poor is the pupil who does not surpass his master.
Sydney J. Harris,The whole purpose of education is to turn mirrors into windows.
E. W. Howe,Some men are alive simply because it is against the law to kill them.
Maureen O'Hara,"John Candy knew he was going to die. He told me on his 40th birthday. He said, well, Maureen, I'm on borrowed time."
Giovanni Falcone,He who doesn't fear death dies only once.
Friedrich Nietzsche,"When one has not had a good father, one must create one."
William Wordsworth,The child is father of the man.
Frank A. Clark,A father is a man who expects his son to be as good a man as he meant to be.
Beau Bridges,My father was my teacher. But most importantly he was a great dad.
Frank Butler,"When I was 18, I thought my father was pretty dumb. After a while when I got to be 21, I was amazed to find out how much he'd learned in three years."
Joan Rivers,"Diets, like clothes, should be tailored to you."
Orson Welles,My doctor told me to stop having intimate dinners for four. Unless there are three other people.
Thomas Jefferson,We never repent of having eaten too little.
Maimonides,No disease that can be treated by diet should be treated with any other means.
Drew Carey,"The easiest diet is, you know, eat vegetables, eat fresh food. Just a really sensible healthy diet like you read about all the time."
Mireille Guiliano,"Once you have to start counting calories, it takes away from the joy of eating."
Jesse Owens,"We all have dreams. But in order to make dreams come into reality, it takes an awful lot of determination, dedication, self-discipline, and effort."
James Dean,Dream as if you'll live forever. Live as if you'll die today.
T. E. Lawrence,"All men dream, but not equally. Those who dream by night in the dusty recesses of their minds, wake in the day to find that it was vanity: but the dreamers of the day are dangerous men, for they may act on their dreams with open eyes, to make them possible."
Carl Jung,"Who looks outside, dreams; who looks inside, awakes."
Anatole France,"To accomplish great things, we must not only act, but also dream; not only plan, but also believe."
Yoko Ono,A dream you dream alone is only a dream. A dream you dream together is reality.
Henry David Thoreau,"If one advances confidently in the direction of his dreams, and endeavors to live the life which he has imagined, he will meet with a success unexpected in common hours."
Paul Valery,The best way to make your dreams come true is to wake up.
Tupac Shakur,Reality is wrong. Dreams are for real.
Oscar Wilde,"A dreamer is one who can only find his way by moonlight, and his punishment is that he sees the dawn before the rest of the world."
William Butler Yeats,"But I, being poor, have only my dreams; I have spread my dreams under your feet; Tread softly because you tread on my dreams."
Langston Hughes,"Hold fast to dreams, for if dreams die, life is a broken-winged bird that cannot fly."
Mike Tyson,"I'm a dreamer. I have to dream and reach for the stars, and if I miss a star then I grab a handful of clouds."
Vincent Van Gogh,I dream of painting and then I paint my dream.
Janet Jackson,"Dreams can become a reality when we possess a vision that is characterized by the willingness to work hard, a desire for excellence, and a belief in our right and our responsiblity to be equal members of society."
Antoine de Saint-Exupery,"A designer knows he has achieved perfection not when there is nothing left to add, but when there is nothing left to take away."
Charles Eames,The details are not the details. They make the design.
Walt Disney,"You can design and create, and build the most wonderful place in the world. But it takes people to make the dream a reality."
Jack Nicholson,There's only two people in your life you should lie to... the police and your girlfriend.
Orson Welles,"If there hadn't been women we'd still be squatting in a cave eating raw meat, because we made civilization in order to impress our girlfriends."
Thomas Fuller,Choose a wife rather by your ear than your eye.
Joey Adams,"Never let a fool kiss you, or a kiss fool you."
Clifford Stoll,"Data is not information, information is not knowledge, knowledge is not understanding, understanding is not wisdom."
Leo Buscaglia,Change is the end result of all true learning.
Will Rogers,"Everybody is ignorant, only on different subjects."
Abu Bakr,"Cursed is the man who dies, but the evil done by him survives."
Annie Lennox,"Dying is easy, it's living that scares me to death."
Steven Wright,"When I die, I'm leaving my body to science fiction."
Erik Erikson,Healthy children will not fear life if their elders have integrity enough not to fear death.
Dawn French,It was my father who taught me to value myself. He told me that I was uncommonly beautiful and that I was the most precious thing in his life.
Harry S Truman,"My father was not a failure. After all, he was the father of a president of the United States."
Dolly Parton,Every single diet I ever fell off of was because of potatoes and gravy of some sort.
Kelly Clarkson,"I love healthy stuff and junk an equal amount. Whatever I'm craving, I go for it. I'm never trying to lose weight - or gain it. I'm just being."
Mark Hyman,"Calories from protein affect your brain, your appetite control center, so you are more satiated and satisfied."
Mae West,I never worry about diets. The only carrots that interest me are the number you get in a diamond.
Alexander Pope,"What some call health, if purchased by perpetual anxiety about diet, isn't much better than tedious disease."
Mitch Hedberg,"I'm sick of following my dreams. I'm just going to ask them where they're goin', and hook up with them later."
Zhuangzi,"I dreamed I was a butterfly, flitting around in the sky; then I awoke. Now I wonder: Am I a man who dreamt of being a butterfly, or am I a butterfly dreaming that I am a man?"
Carl Sandburg,Nothing happens unless first we dream.
Edgar Allan Poe,"Deep into that darkness peering, long I stood there, wondering, fearing, doubting, dreaming dreams no mortal ever dared to dream before."
Edgar Cayce,Dreams are today's answers to tomorrow's questions.
Joel Osteen,Do all you can to make your dreams come true.
Dalai Lama,Sleep is the best meditation.
Sarah Ban Breathnach,"The world needs dreamers and the world needs doers. But above all, the world needs dreamers who do."
Branch Rickey,Luck is the residue of design.
Steve Jobs,Design is not just what it looks like and feels like. Design is how it works.
Elon Musk,Any product that needs a manual to work is broken.
Coco Chanel,"Fashion fades, only style remains the same."
Ralph Lauren,"I don't design clothes, I design dreams."
Le Corbusier,Space and light and order. Those are the things that men need just as much as they need bread or a place to sleep.
Frank Lloyd Wright,Space is the breath of art.
Herbert A. Simon,Everyone designs who devises courses of action aimed at changing existing situations into preferred ones.
Christian Louboutin,"A shoe is not only a design, but it's a part of your body language, the way you walk. The way you're going to move is quite dictated by your shoes."
Ludwig Mies van der Rohe,A chair is a very difficult object. A skyscraper is almost easier. That is why Chippendale is famous.
Louis Kahn,"Design is not making beauty, beauty emerges from selection, affinities, integration, love."
Thomas J. Watson,Design must reflect the practical and aesthetic in business but above all... good design must primarily serve people.
Kenzo Tange,Designs of purely arbitrary nature cannot be expected to last long.
Alec Issigonis,A camel is a horse designed by committee.
Issey Miyake,Design is not for philosophy it's for life.
Dieter Rams,Good design is making something intelligible and memorable. Great design is making something memorable and meaningful.
Scott Adams,"Nothing defines humans better than their willingness to do irrational things in the pursuit of phenomenally unlikely payoffs. This is the principle behind lotteries, dating, and religion."
Mae West,"Save a boyfriend for a rainy day - and another, in case it doesn't rain."
Billie Holiday,"A kiss that is never tasted, is forever and ever wasted."
William Butler Yeats,Wine comes in at the mouth And love comes in at the eye; That's all we shall know for truth Before we grow old and die.
Honore de Balzac,No man should marry until he has studied anatomy and dissected at least one woman.
Keanu Reeves,"Kissing someone is pretty intimate, actually very intimate, and your heart always kind of skips a beat before you do that."
Tim Allen,"Women are like cars: we all want a Ferrari, sometimes want a pickup truck, and end up with a station wagon."
Natalie Portman,Smart women love smart men more than smart men love smart women.
