author,quote
Roger Ebert,Every great film should seem new every time you see it.
James Cameron,"Pick up a camera. Shoot something. No matter how small, no matter how cheesy, no matter whether your friends and your sister star in it. Put your name on it as director. Now you're a director. Everything after that you're just negotiating your budget and your fee."
Peter Jackson,The most honest form of filmmaking is to make a film for yourself.
Barbara Kingsolver,Sometimes the strength of motherhood is greater than natural laws.
Gloria Estefan,Motherhood is... difficult and... rewarding.
Alicia Keys,My mom is definitely my rock.
Henri de Toulouse-Lautrec,"My dear Mama, you are definitely the hen who hatched a famous duck."
Gilbert Parker,For when a child is born the mother also is born again.
Isadora Duncan,With what price we pay for the glory of motherhood.
Martina Hingis,I was always at peace because of the way my mom treated me.
Antonio Villaraigosa,I got to grow up with a mother who taught me to believe in me.
Henry Ward Beecher,"The babe at first feeds upon the mother's bosom, but it is always on her heart."
Billy Sunday,There is nothing in the world of art like the songs mother used to sing.
Gracie Allen,When my mother had to get dinner for 8 she'd just make enough for 16 and only serve half.
Donald E. Westlake,Who's a boy gonna talk to if not his mother?
Abraham Lincoln,I remember my mother's prayers and they have always followed me. They have clung to me all my life.
Mahatma Gandhi,Man becomes great exactly in the degree in which he works for the welfare of his fellow-men.
Menander,Culture makes all men gentle.
Francois de La Rochefoucauld,"Passion makes idiots of the cleverest men, and makes the biggest idiots clever."
Daniel Webster,"Whatever makes men good Christians, makes them good citizens."
E. B. White,Luck is not something you can mention in the presence of self-made men.
Honore de Balzac,"When women love us, they forgive us everything, even our crimes; when they do not love us, they give us credit for nothing, not even our virtues."
Clint Eastwood,Men must know their limitations.
Iris Murdoch,"Every man needs two women: a quiet home-maker, and a thrilling nymph."
Hunter S. Thompson,Politics is the art of controlling your environment.
Ross Perot,"War has rules, mud wrestling has rules - politics has no rules."
Kin Hubbard,We would all like to vote for the best man but he is never a candidate.
E. B. White,Democracy is the recurrent suspicion that more than half of the people are right more than half of the time.
Robin Williams,People say satire is dead. It's not dead; it's alive and living in the White House.
Bill Maher,"Freedom isn't free. It shouldn't be a bragging point that 'Oh, I don't get involved in politics,' as if that makes someone cleaner. No, that makes you derelict of duty in a republic. Liars and panderers in government would have a much harder time of it if so many people didn't insist on their right to remain ignorant and blindly agreeable."
R. Buckminster Fuller,Pollution is nothing but the resources we are not harvesting. We allow them to disperse because we've been ignorant of their value.
Benjamin Disraeli,There is no gambling like politics.
B. R. Ambedkar,Every man who repeats the dogma of Mill that one country is no fit to rule another country must admit that one class is not fit to rule another class.
Elon Musk,"In order to have your voice be heard in Washington, you have to make some little contribution."
Gertrude Stein,There ain't no answer. There ain't gonna be any answer. There never has been an answer. That's the answer.
Fergie,Dick Clark will be truly missed. We will carry on his legacy every New Year's Eve.
Akhenaton,"Those who gave thee a body, furnished it with weakness; but He who gave thee Soul, armed thee with resolution. Employ it, and thou art wise; be wise and thou art happy."
Goran Persson,"Let our New Year's resolution be this: we will be there for one another as fellow members of humanity, in the finest sense of the word."
William Cullen Bryant,"And suns grow meek, and the meek suns grow brief, and the year smiles as it draws near its death."
James Agate,"New Year's Resolution: To tolerate fools more gladly, provided this does not encourage them to take up more of my time."
Joe Jonas,"I had a New Year's kiss once. But it was like, 'Let's start the year off together,' and then we wound up breaking up the night after!"
James Lafferty,My New Year's resolution is to stick to a good workout plan that will keep me healthy and happy.
Phil McGraw,"A year from now, you're gonna weigh more or less than what you do right now."
Cyril Cusack,"If you asked me for my New Year Resolution, it would be to find out who I am."
Carl Sandburg,I doubt if you can have a truly wild party without liquor.
Mary-Kate Olsen,I like to go to parties where I know everyone. How are you going to have fun with people you don't know?
Neil Young,Earth is a flower and it's pollinating.
Henry Wadsworth Longfellow,The best thing one can do when it's raining is to let it rain.
D. H. Lawrence,"The fairest thing in nature, a flower, still has its roots in earth and manure."
William Shakespeare,One touch of nature makes the whole world kin.
William Cowper,No man can be a patriot on an empty stomach.
William Pitt,"If I were an American, as I am an Englishman, while a foreign troop was landed in my country, I never would lay down my arms never never never!"
Dale Carnegie,Each nation feels superior to other nations. That breeds patriotism - and wars.
Pablo Casals,The love of one's country is a splendid thing. But why should love stop at the border?
Jesse Ventura,There is much more to being a patriot and a citizen than reciting the pledge or raising a flag.
William Shakespeare,"If music be the food of love, play on."
Mickey Hart,There's nothing like music to relieve the soul and uplift it.
Maurice Ravel,The only love affair I have ever had was with music.
Paul Simon,"Music is forever; music should grow and mature with you, following you right on up until you die."
Gustav Mahler,If a composer could say what he had to say in words he would not bother trying to say it in music.
Sidney Lanier,Music is love in search of a word.
Psy,The world's most famous and popular language is music.
Gerard Way,"Remember the first time you went to a show and saw your favorite band. You wore their shirt, and sang every word. You didn't know anything about scene politics, haircuts, or what was cool. All you knew was that this music made you feel different from anyone you shared a locker with. Someone finally understood you. This is what music is about."
Reba McEntire,"For me, singing sad songs often has a way of healing a situation. It gets the hurt out in the open into the light, out of the darkness."
Herbie Hancock,Music happens to be an art form that transcends language.
Andres Segovia,"Lean your body forward slightly to support the guitar against your chest, for the poetry of the music should resound in your heart."
Edgar Winter,"Music is very spiritual, it has the power to bring people together."
William Congreve,"Music has charms to sooth a savage breast, to soften rocks, or bend a knotted oak."
Charles Stanley,"We can be tired, weary and emotionally distraught, but after spending time alone with God, we find that He injects into our bodies energy, power and strength."
George Herbert,"He that is not handsome at 20, nor strong at 30, nor rich at 40, nor wise at 50, will never be handsome, strong, rich or wise."
George Henry Lewes,Insincerity is always weakness; sincerity even in error is strength.
Orison Swett Marden,Don't wait for extraordinary opportunities. Seize common occasions and make them great. Weak men wait for opportunities; strong men make them.
Layne Staley,My bad habits aren't my title. My strengths and my talent are my title.
Ovid,Endure and persist; this pain will turn to good by and by.
Dale Carnegie,"Don't be afraid to give your best to what seemingly are small jobs. Every time you conquer one it makes you that much stronger. If you do the little jobs well, the big ones will tend to take care of themselves."
Liane Cordes,Continuous effort - not strength or intelligence - is the key to unlocking our potential.
Albert Einstein,Let every man be respected as an individual and no man idolized.
Leon Kass,"I have nothing against respecting people who lived before, but we have no responsibility toward them."
Tupac Shakur,America wants its respect.
Marilyn Monroe,Men are so willing to respect anything that bores them.
A. P. J. Abdul Kalam,"If we are not free, no one will respect us."
Jennifer Capriati,People want to hear what I have to say and respect what I say.
John Updike,"Americans have been conditioned to respect newness, whatever it costs them."
Malcolm X,"Be peaceful, be courteous, obey the law, respect everyone; but if someone puts his hand on you, send him to the cemetery."
Bruce Lee,"Knowledge will give you power, but character respect."
Deborah Tannen,Each underestimates her own power and overestimates the other's.
Richard J. Daley,Power is dangerous unless you have humility.
Baruch Spinoza,Ambition is the immoderate desire for power.
Phaedrus,An alliance with a powerful person is never safe.
Erich Fromm,There is no meaning to life except the meaning man gives his life by the unfolding of his powers.
Andrew Jackson,"Money is power, and in that government which pays all the public officers of the states will all political power be substantially concentrated."
Friedrich Schiller,Power is the most persuasive rhetoric.
C. Wright Mills,Prestige is the shadow of money and power.
Alvin Toffler,Knowledge is the most democratic source of power.
Jack London,You can't wait for inspiration. You have to go after it with a club.
Unknown,The past cannot be changed. The future is yet in your power.
A. P. J. Abdul Kalam,We should not give up and we should not allow the problem to defeat us.
Marilyn vos Savant,"A good idea will keep you awake during the morning, but a great idea will keep you awake during the night."
Ray Bradbury,"Love. Fall in love and stay in love. Write only what you love, and love what you write. The key word is love. You have to get up in the morning and write something you love, something to live for."
Ovid,"First thing every morning before you arise say out loud, 'I believe,' three times."
Victor Hugo,"He, who every morning plans the transactions of the day, and follows that plan, carries a thread that will guide him through a labyrinth of the most busy life."
David Hockney,"I'm a very early riser, and I don't like to miss that beautiful early morning light."
Alexis Carrel,The most efficient way to live reasonably is every morning to make a plan of one's day and every night to examine the results obtained.
Jennifer Aniston,"What inspires you, what excites you when you wake up in the morning?"
Robert Orben,"Every morning I get up and look through the Forbes list of the richest people in America. If I'm not there, I go to work."
James Russell Lowell,"Thank God every morning when you get up that you have something to do that day, which must be done, whether you like it or not."
Bram Stoker,No man knows till he has suffered from the night how sweet and dear to his heart and eye the morning can be.
Robert Duvall,I love the smell of juice boxes in the morning.
Henry Miller,"I have no money, no resources, no hopes. I am the happiest man alive."
Jonathan Swift,"A wise man should have money in his head, but not in his heart."
William Shakespeare,My pride fell with my fortunes.
Kin Hubbard,The safe way to double your money is to fold it over once and put it in your pocket.
Marlon Brando,Never confuse the size of your paycheck with the size of your talent.
Woody Allen,"Money is better than poverty, if only for financial reasons."
John Dewey,No man's credit is as good as his money.
Ralph Waldo Emerson,Money often costs too much.
Mother Teresa,"Let us not be satisfied with just giving money. Money is not enough, money can be got, but they need your hearts to love them. So, spread your love everywhere you go."
Coco Chanel,There are people who have money and people who are rich.
Marlene Dietrich,There is a gigantic difference between earning a great deal of money and being rich.
Christopher Marlowe,"Money can't buy love, but it improves your bargaining position."
Groucho Marx,Alimony is like buying hay for a dead horse.
Josh Billings,"Money will buy a pretty good dog, but it won't buy the wag of his tail."
Saint Augustine,"The purpose of all wars, is peace."
Thomas Fuller,It is madness for sheep to talk peace with a wolf.
William E. Gladstone,We look forward to the time when the Power of Love will replace the Love of Power. Then will our world know the blessings of peace.
Helen Keller,"I do not want the peace which passeth understanding, I want the understanding which bringeth peace."
William Hazlitt,Those who are at war with others are not at peace with themselves.
Thomas a Kempis,"First keep peace with yourself, then you can also bring peace to others."
George Bernard Shaw,"Peace is not only better than war, but infinitely more arduous."
Benazir Bhutto,Democracy is necessary to peace and to undermining the forces of terrorism.
James E. Faust,"We are bombarded on all sides by a vast number of messages we don't want or need. More information is generated in a single day than we can absorb in a lifetime. To fully enjoy life, all of us must find our own breathing space and peace of mind."
Robert Burton,A quiet mind cureth all.
Tacitus,A bad peace is even worse than war.
Isabel Allende,"I can promise you that women working together - linked, informed and educated - can bring peace and prosperity to this forsaken planet."
Alanis Morissette,"Peace of mind for five minutes, that's what I crave."
Potter Stewart,Ethics is knowing the difference between what you have a right to do and what is right to do.
Marcus Tullius Cicero,"More law, less justice."
Thomas Hobbes,It is not wisdom but Authority that makes a law.
Voltaire,It is better to risk saving a guilty man than to condemn an innocent one.
Will Rogers,Make crime pay. Become a lawyer.
William E. Gladstone,Justice delayed is justice denied.
Honore de Balzac,Laws are spider webs through which the big flies pass and the little ones get caught.
Julius Caesar,"If you must break the law, do it to seize power: in all other cases observe it."
Confucius,"To know what you know and what you do not know, that is true knowledge."
Kofi Annan,"Knowledge is power. Information is liberating. Education is the premise of progress, in every society, in every family."
Plato,Opinion is the medium between knowledge and ignorance.
Voltaire,One merit of poetry few persons will deny: it says more and in fewer words than prose.
Bob Marley,"Life is one big road with lots of signs. So when you riding through the ruts, don't complicate your mind. Flee from hate, mischief and jealousy. Don't bury your thoughts, put your vision to reality. Wake Up and Live!"
F. Scott Fitzgerald,The test of a first-rate intelligence is the ability to hold two opposed ideas in mind at the same time and still retain the ability to function.
Arthur Schopenhauer,Talent hits a target no one else can hit; Genius hits a target no one else can see.
Aristotle,There is no great genius without some touch of madness.
George S. Patton,"If everyone is thinking alike, then somebody isn't thinking."
Voltaire,Common sense is not so common.
Ann Landers,"Love is friendship that has caught fire. It is quiet understanding, mutual confidence, sharing and forgiving. It is loyalty through good and bad times. It settles for less than perfection and makes allowances for human weaknesses."
Aristotle,Love is composed of a single soul inhabiting two bodies.
Khalil Gibran,Life without love is like a tree without blossoms or fruit.
Francois de La Rochefoucauld,"True love is like ghosts, which everyone talks about and few have seen."
Rumi,We are born of love; Love is our mother.
Ferdinand Foch,The most powerful weapon on earth is the human soul on fire.
Mahatma Gandhi,Where there is love there is life.
Alphonse de Lamartine,There is a woman at the beginning of all great things.
Vincent Van Gogh,I feel that there is nothing more truly artistic than to love people.
Albert Einstein,You can't blame gravity for falling in love.
Rainer Maria Rilke,"Once the realization is accepted that even between the closest human beings infinite distances continue, a wonderful living side by side can grow, if they succeed in loving the distance between them which makes it possible for each to see the other whole against the sky."
Victor Hugo,Life is the flower for which love is the honey.
Rabindranath Tagore,Love is the only reality and it is not a mere sentiment. It is the ultimate truth that lies at the heart of creation.
Antoine de Saint-Exupery,"Love does not consist in gazing at each other, but in looking outward together in the same direction."
Dalai Lama,"Our prime purpose in this life is to help others. And if you can't help them, at least don't hurt them."
Cesare Pavese,"We do not remember days, we remember moments."
Elon Musk,Life is too short for long-term grudges.
Eminem,"The truth is you don't know what is going to happen tomorrow. Life is a crazy ride, and nothing is guaranteed."
Friedrich Nietzsche,He who has a why to live can bear almost any how.
William Morris,The true secret of happiness lies in taking a genuine interest in all the details of daily life.
Eric Butterworth,"Don't go through life, grow through life."
John Lennon,Life is what happens while you are busy making other plans.
Sai Baba,Life is a song - sing it. Life is a game - play it. Life is a challenge - meet it. Life is a dream - realize it. Life is a sacrifice - offer it. Life is love - enjoy it.
Nelson Mandela,"It is better to lead from behind and to put others in front, especially when you celebrate victory when nice things occur. You take the front line when there is danger. Then people will appreciate your leadership."
Henry Ford,"If you think you can do a thing or think you can't do a thing, you're right."
Colin Powell,Leadership is solving problems. The day soldiers stop bringing you their problems is the day you have stopped leading them. They have either lost confidence that you can help or concluded you do not care. Either case is a failure of leadership.
Chris Hadfield,"Ultimately, leadership is not about glorious crowning acts. It's about keeping your team focused on a goal and motivated to do their best to achieve it, especially when the stakes are high and the consequences really matter. It is about laying the groundwork for others' success, and then standing back and letting them shine."
Steve Jobs,Innovation distinguishes between a leader and a follower.
Arnold H. Glasow,"A good leader takes a little more than his share of the blame, a little less than his share of the credit."
Thomas Sowell,People who enjoy meetings should not be in charge of anything.
"Martin Luther King, Jr.",A genuine leader is not a searcher for consensus but a molder of consensus.
George W. Bush,"Leadership to me means duty, honor, country. It means character, and it means listening from time to time."
Thomas Aquinas,"If the highest aim of a captain were to preserve his ship, he would keep it in port forever."
Napoleon Bonaparte,A leader is a dealer in hope.
Max Lucado,A man who wants to lead the orchestra must turn his back on the crowd.
John F. Kennedy,Leadership and learning are indispensable to each other.
Bruce Lee,A wise man can learn more from a foolish question than a fool can learn from a wise answer.
Leonardo da Vinci,Learning never exhausts the mind.
George Bernard Shaw,"I learned long ago, never to wrestle with a pig. You get dirty, and besides, the pig likes it."
Albert Einstein,"If we knew what it was we were doing, it would not be called research, would it?"
Neil Armstrong,Research is creating new knowledge.
Thomas Huxley,Try to learn something about everything and everything about something.
Friedrich Nietzsche,He who would learn to fly one day must first learn to stand and walk and run and climb and dance; one cannot fly into flying.
Jiddu Krishnamurti,"There is no end to education. It is not that you read a book, pass an examination, and finish with education. The whole of life, from the moment you are born to the moment you die, is a process of learning."
William S. Burroughs,Your mind will answer most questions if you learn to relax and wait for the answer.
Bill Gates,Your most unhappy customers are your greatest source of learning.
Michelle Obama,We learned about honesty and integrity - that the truth matters... that you don't take shortcuts or play by your own set of rules... and success doesn't count unless you earn it fair and square.
Winston Churchill,I am always ready to learn although I do not always like being taught.
Frank Lloyd Wright,"Study nature, love nature, stay close to nature. It will never fail you."
Nick Lampson,There is nothing nobler than risking your life for your country.
John M. McHugh,"As America celebrates Memorial Day, we pay tribute to those who have given their lives in our nation's wars."
Paul Tsongas,America is hope. It is compassion. It is excellence. It is valor.
Eric Burdon,"On Memorial Day, I don't want to only remember the combatants. There were also those who came out of the trenches as writers and poets, who started preaching peace, men and women who have made this world a kinder place to live."
Bob Riley,I have long believed that sacrifice is the pinnacle of patriotism.
Zebulon Pike,"May Heaven be propitious, and smile on the cause of my country."
Will Carleton,"Over all our happy country - over all our Nation spread, Is a band of noble heroes - is our Army of the Dead."
Christopher Gadsden,"What I can do for my country, I am willing to do."
Robert Charles Winthrop,There are no points of the compass on the chart of true patriotism.
Alexander Smith,I would rather be remembered by a song than by a victory.
Robert Reich,True patriotism isn't cheap. It's about taking on a fair share of the burden of keeping America going.
Erma Bombeck,Never go to a doctor whose office plants have died.
Anton Chekhov,"Medicine is my lawful wife and literature my mistress; when I get tired of one, I spend the night with the other."
Edwin Way Teale,"For the mind disturbed, the still beauty of dawn is nature's finest balm."
Lucius Annaeus Seneca,"A physician is not angry at the intemperance of a mad patient, nor does he take it ill to be railed at by a man in fever. Just so should a wise man treat all mankind, as a physician does his patient, and look upon them only as sick and extravagant."
Plato,They certainly give very strange names to diseases.
Dizzy Dean,The doctors x-rayed my head and found nothing.
Henry Ward Beecher,To array a man's will against his sickness is the supreme art of medicine.
Earl Wilson,"You may not be able to read a doctor's handwriting and prescription, but you'll notice his bills are neatly typewritten."
Ovid,Time is generally the best doctor.
Peter Shaffer,"Passion, you see, can be destroyed by a doctor. It cannot be created."
Walter Matthau,"My doctor gave me six months to live, but when I couldn't pay the bill he gave me six months more."
Swami Sivananda,Thinking of disease constantly will intensify it. Feel always 'I am healthily in body and mind'.
Mary Baker Eddy,Disease is an experience of a so-called mortal mind. It is fear made manifest on the body.
Norman Cousins,The human body experiences a powerful gravitational pull in the direction of hope. That is why the patient's hopes are the physician's secret weapon. They are the hidden ingredients in any prescription.
Abraham Lincoln,"Marriage is neither heaven nor hell, it is simply purgatory."
James Dobson,Don't marry the person you think you can live with; marry only the individual you think you can't live without.
Martin Luther,"Let the wife make the husband glad to come home, and let him make her sorry to see him leave."
St. Jerome,Marriage is good for those who are afraid to sleep alone at night.
Andre Maurois,A happy marriage is a long conversation which always seems too short.
Benjamin Franklin,"Keep your eyes wide open before marriage, half shut afterwards."
Henny Youngman,The secret of a happy marriage remains a secret.
John Lyly,Marriages are made in heaven and consummated on Earth.
Barbara Johnson,Patience is the ability to idle your motor when you feel like stripping your gears.
Simone Weil,Humility is attentive patience.
Thomas Carlyle,Endurance is patience concentrated.
Lyman Abbott,Patience is passion tamed.
Soren Kierkegaard,"Patience is necessary, and one cannot reap immediately where one has sown."
Holbrook Jackson,"Patience has its limits, take it too far and it's cowardice."
William Shakespeare,How poor are they that have not patience! What wound did ever heal but by degrees?
Mary Pierce,Sometimes things aren't clear right away. That's where you need to be patient and persevere and see where things lead.
Guy Kawasaki,Patience is the art of concealing your impatience.
Jesse Jackson,"I am not a perfect servant. I am a public servant doing my best against the odds. As I develop and serve, be patient. God is not finished with me yet."
Thomas Fuller,Abused patience turns to fury.
Swami Sivananda,There is something good in all seeming failures. You are not to see that now. Time will reveal it. Be patient.
Randy Johnson,"Work hard. And have patience. Because no matter who you are, you're going to get hurt in your career and you have to be patient to get through the injuries."
William Golding,He who rides the sea of the Nile must have sails woven of patience.
Christiaan Barnard,"Suffering isn't ennobling, recovery is."
Anne Roiphe,Grief is in two parts. The first is loss. The second is the remaking of life.
