author,quote
Sidonie Gabrielle Colette,"The lovesick, the betrayed, and the jealous all smell alike."
Arthur Golden,"Passion can quickly slip to jealousy, or even hatred."
Aphra Behn,"Nothing is more capable of troubling our reason, and consuming our health, than secret notions of jealousy in solitude."
Joseph P. Kennedy,More men die of jealousy than of cancer.
Van Wyck Brooks,"Magnanimous people have no vanity, they have no jealousy, and they feed on the true and the solid wherever they find it. And, what is more, they find it everywhere."
Agatha Christie,These little grey cells. It is up to them.
Deepak Chopra,To think is to practice brain chemistry.
Mark Twain,I must have a prodigious quantity of mind; it takes me as much as a week sometimes to make it up.
Lewis Carroll,It's a poor sort of memory that only works backwards.
Jesse Jackson,"Time is neutral and does not change things. With courage and initiative, leaders change things."
David Joseph Schwartz,How we think shows through in how we act. Attitudes are mirrors of the mind. They reflect thinking.
Golda Meir,A leader who doesn't hesitate before he sends his nation into battle is not fit to be a leader.
James Freeman Clarke,Strong convictions precede great actions.
Carine Roitfeld,You discover yourself through the research of your work.
Walt Whitman,"Have you learned the lessons only of those who admired you, and were tender with you, and stood aside for you? Have you not learned great lessons from those who braced themselves against you, and disputed passage with you?"
Ann Landers,Sensual pleasures have the fleeting brilliance of a comet; a happy marriage has the tranquillity of a lovely sunset.
Johnny Carson,Married men live longer than single men. But married men are a lot more willing to die.
Cher,Husbands are like fires - they go out when they're left unattended.
Josh Billings,"Marrying for love may be a bit risky, but it is so honest that God can't help but smile on it."
George Jessel,Marriage is a mistake every man should make.
Catherine Zeta-Jones,"For marriage to be a success, every woman and every man should have her and his own bathroom. The end."
Yoko Ono,"Marriage is a gamble, let's be honest."
Stephen Leacock,Many a man in love with a dimple makes the mistake of marrying the whole girl.
Rainer Maria Rilke,The only journey is the one within.
Swami Sivananda,"Put your heart, mind, and soul into even your smallest acts. This is the secret of success."
Norman Vincent Peale,Change your thoughts and you change your world.
Edith Wharton,There are two ways of spreading light: to be the candle or the mirror that reflects it.
Tony Robbins,It is in your moments of decision that your destiny is shaped.
Mahatma Gandhi,"In a gentle way, you can shake the world."
Octavia E. Butler,"Every story I create, creates me. I write to create myself."
Ben Okri,"The most authentic thing about us is our capacity to create, to overcome, to endure, to transform, to love and to be greater than our suffering."
Arthur C. Clarke,The only way to discover the limits of the possible is to go beyond them into the impossible.
Jim Rohn,Happiness is not something you postpone for the future; it is something you design for the present.
Carol Burnett,"When you have a dream, you've got to grab it and never let go."
Robert Green Ingersoll,I am the inferior of any man whose rights I trample under foot.
Alice Walker,Don't wait around for other people to be happy for you. Any happiness you get you've got to make yourself.
Lawrence G. Lovasik,"Try to make at least one person happy every day. If you cannot do a kind deed, speak a kind word. If you cannot speak a kind word, think a kind thought. Count up, if you can, the treasure of happiness that you would dispense in a week, in a year, in a lifetime!"
David Lee Roth,"Money can't buy you happiness, but it can buy you a yacht big enough to pull up right alongside it."
Jean-Jacques Rousseau,What wisdom can you find that is greater than kindness?
Florence Scovel Shinn,"Every great work, every big accomplishment, has been brought into manifestation through holding to the vision, and often just before the big achievement, comes apparent failure and discouragement."
Fyodor Dostoevsky,The greatest happiness is to know the source of unhappiness.
Walt Whitman,"To have great poets, there must be great audiences."
Joe Paterno,Believe deep down in your heart that you're destined to do great things.
Tom Hopkins,"You are your greatest asset. Put your time, effort and money into training, grooming, and encouraging your greatest asset."
Francis Bacon,"Hope is a good breakfast, but it is a bad supper."
Elie Wiesel,Hope is like peace. It is not a gift from God. It is a gift only we can give one another.
David Ben-Gurion,Anyone who doesn't believe in miracles is not a realist.
Mark Twain,Lord save us all from old age and broken health and a hope tree that has lost the faculty of putting out blossoms.
Thomas Hardy,The sudden disappointment of a hope leaves a scar which the ultimate fulfillment of that hope never entirely removes.
Tertullian,Hope is patience with the lamp lit.
Rick Warren,"What gives me the most hope every day is God's grace; knowing that his grace is going to give me the strength for whatever I face, knowing that nothing is a surprise to God."
Calvin Coolidge,Little progress can be made by merely attempting to repress what is evil. Our great hope lies in developing what is good.
Robert Green Ingersoll,Hope is the only bee that makes honey without flowers.
Martin Luther,Everything that is done in the world is done by hope.
Henry Rollins,Hope is the last thing a person does before they are defeated.
Jim DeMint,"One of the greatest titles in the world is parent, and one of the biggest blessings in the world is to have parents to call mom and dad."
William Shakespeare,It is a wise father that knows his own child.
Thomas Szasz,The stupid neither forgive nor forget; the naive forgive and forget; the wise forgive but do not forget.
Maya Angelou,"It's one of the greatest gifts you can give yourself, to forgive. Forgive everybody."
William Shakespeare,Sweet mercy is nobility's true badge.
Josh Billings,There is no revenge so complete as forgiveness.
Tyler Perry,"It's not an easy journey, to get to a place where you forgive people. But it is such a powerful place, because it frees you."
Emo Philips,When I was a kid I used to pray every night for a new bicycle. Then I realised that the Lord doesn't work that way so I stole one and asked Him to forgive me.
Jim Rohn,Take care of your body. It's the only place you have to live.
Steven Wright,"A lot of people are afraid of heights. Not me, I'm afraid of widths."
Joseph Addison,Reading is to the mind what exercise is to the body.
John F. Kennedy,"Physical fitness is not only one of the most important keys to a healthy body, it is the basis of dynamic and creative intellectual activity."
Denis Waitley,Time and health are two precious assets that we don't recognize and appreciate until they have been depleted.
Thomas Jefferson,Walking is the best possible exercise. Habituate yourself to walk very far.
Mitch Hedberg,My fake plants died because I did not pretend to water them.
W. H. Auden,We are all here on earth to help others; what on earth the others are here for I don't know.
Douglas Adams,I love deadlines. I like the whooshing sound they make as they fly by.
Robert A. Heinlein,Yield to temptation. It may not pass your way again.
Steven Wright,What's another word for Thesaurus?
Mae West,"Between two evils, I always pick the one I never tried before."
George Eliot,He was like a cock who thought the sun had risen to hear him crow.
Napoleon Bonaparte,"Glory is fleeting, but obscurity is forever."
Bill Murray,"I always want to say to people who want to be rich and famous: 'try being rich first'. See if that doesn't cover most of it. There's not much downside to being rich, other than paying taxes and having your relatives ask you for money. But when you become famous, you end up with a 24-hour job."
Jiddu Krishnamurti,"We all want to be famous people, and the moment we want to be something we are no longer free."
Al Pacino,The hardest thing about being famous is that people are always nice to you. You're in a conversation and everybody's agreeing with what you're saying - even if you say something totally crazy. You need people who can tell you what you don't want to hear.
Niccolo Machiavelli,"It is better to be feared than loved, if you cannot be both."
Buddha,Even death is not to be feared by one who has lived wisely.
Franklin D. Roosevelt,The only thing we have to fear is fear itself.
Desmond Tutu,"You don't choose your family. They are God's gift to you, as you are to them."
Richard Bach,"The bond that links your true family is not one of blood, but of respect and joy in each other's life."
Michael J. Fox,Family is not an important thing. It's everything.
Khalil Gibran,Your children are not your children. They are the sons and daughters of Life's longing for itself. They came through you but not from you and though they are with you yet they belong not to you.
Virginia Woolf,"One cannot think well, love well, sleep well, if one has not dined well."
W. C. Fields,"Once, during Prohibition, I was forced to live for days on nothing but food and water."
Ronald Reagan,You can tell alot about a fellow's character by his way of eating jellybeans.
Ina Garten,"Instead of going out to dinner, buy good food. Cooking at home shows such affection. In a bad economy, it's more important to make yourself feel good."
Yogi Berra,You better cut the pizza in four pieces because I'm not hungry enough to eat six.
Cesar Chavez,"If you really want to make a friend, go to someone's house and eat with him... the people who give you their food give you their heart."
Franz Kafka,"So long as you have food in your mouth, you have solved all questions for the time being."
James Beard,"Food is our common ground, a universal experience."
Moliere,"One should eat to live, not live to eat."
Doug Larson,Life expectancy would grow by leaps and bounds if green vegetables smelled as good as bacon.
Ludwig van Beethoven,Only the pure in heart can make a good soup.
James Russell Lowell,Democracy gives every man the right to be his own oppressor.
"William F. Buckley, Jr.",I'd rather entrust the government of the United States to the first 400 people listed in the Boston telephone directory than to the faculty of Harvard University.
H. L. Mencken,Democracy is the art and science of running the circus from the monkey cage.
Alexander Hamilton,"It's not tyranny we desire; it's a just, limited, federal government."
Vladimir Lenin,The oppressed are allowed once every few years to decide which particular representatives of the oppressing class are to represent and repress them in parliament.
Saint Augustine,"In the absence of justice, what is sovereignty but organized robbery?"
Johann Wolfgang von Goethe,The best government is that which teaches us to govern ourselves.
Chris Rock,You don't pay taxes - they take taxes.
Napoleon Bonaparte,I am sometimes a fox and sometimes a lion. The whole secret of government lies in knowing when to be the one or the other.
Benjamin Franklin,"In this world nothing can be said to be certain, except death and taxes."
John Kenneth Galbraith,"Under capitalism, man exploits man. Under communism, it's just the opposite."
Milton Friedman,Inflation is taxation without legislation.
John Maynard Keynes,The avoidance of taxes is the only intellectual pursuit that still carries any reward.
John D. Rockefeller,The way to make money is to buy when blood is running in the streets.
Epictetus,"Wealth consists not in having great possessions, but in having few wants."
Friedrich August von Hayek,The curious task of economics is to demonstrate to men how little they really know about what they imagine they can design.
John Locke,"Our incomes are like our shoes; if too small, they gall and pinch us; but if too large, they cause us to stumble and to trip."
Thomas Aquinas,There is nothing on this earth more to be prized than true friendship.
Oprah Winfrey,"Lots of people want to ride with you in the limo, but what you want is someone who will take the bus with you when the limo breaks down."
Albert Schweitzer,"In everyone's life, at some time, our inner fire goes out. It is then burst into flame by an encounter with another human being. We should all be thankful for those people who rekindle the inner spirit."
Oscar Wilde,True friends stab you in the front.
Hubert H. Humphrey,"The greatest gift of life is friendship, and I have received it."
Ulysses S. Grant,The friend in my adversity I shall always cherish most. I can better trust those who helped to relieve the gloom of my dark hours than those who are so ready to enjoy with me the sunshine of my prosperity.
Herodotus,Of all possessions a friend is the most precious.
Anais Nin,"Each friend represents a world in us, a world not born until they arrive, and it is only by this meeting that a new world is born."
Henry Ford,My best friend is the one who brings out the best in me.
Euripides,One loyal friend is worth ten thousand relatives.
Chanakya,There is some self-interest behind every friendship. There is no friendship without self-interests. This is a bitter truth.
George Washington,"Be courteous to all, but intimate with few, and let those few be well tried before you give them your confidence."
Soren Kierkegaard,People demand freedom of speech as a compensation for the freedom of thought which they seldom use.
Robert A. Heinlein,"I am free because I know that I alone am morally responsible for everything I do. I am free, no matter what rules surround me. If I find them tolerable, I tolerate them; if I find them too obnoxious, I break them. I am free because I know that I alone am morally responsible for everything I do."
Nikos Kazantzakis,I hope for nothing. I fear nothing. I am free.
Karl Marx,Necessity is blind until it becomes conscious. Freedom is the consciousness of necessity.
Thomas Jefferson,The boisterous sea of liberty is never without a wave.
Robert Frost,Freedom lies in being bold.
Pablo Picasso,The chief enemy of creativity is 'good' sense.
Emma Bunton,"Be sweet, be good, and honest always."
Eli Pariser,"To be a good citizen, it's important to be able to put yourself in other people's shoes and see the big picture. If everything you see is rooted in your own identity, that becomes difficult or impossible."
Christopher Morley,"There are three ingredients in the good life: learning, earning and yearning."
Cavett Robert,"If you don't think every day is a good day, just try missing one."
Lefty Gomez,I'd rather be lucky than good.
Oscar Wilde,I sometimes think that God in creating man somewhat overestimated his ability.
"Martin Luther King, Jr.","I just want to do God's will. And he's allowed me to go to the mountain. And I've looked over, and I've seen the promised land! I may not get there with you, but I want you to know tonight that we as a people will get to the promised land."
John Lennon,"I believe in God, but not as one thing, not as an old man in the sky. I believe that what people call God is something in all of us. I believe that what Jesus and Mohammed and Buddha and all the rest said was right. It's just that the translations have gone wrong."
Gertrude Jekyll,A garden is a grand teacher. It teaches patience and careful watchfulness; it teaches industry and thrift; above all it teaches entire trust.
Martin Heidegger,To dwell is to garden.
Ralph Waldo Emerson,What is a weed? A plant whose virtues have never been discovered.
Khalil Gibran,And forget not that the earth delights to feel your bare feet and the winds long to play with your hair.
Richard Brinsley Sheridan,Won't you come into the garden? I would like my roses to see you.
William Wordsworth,The flower that smells the sweetest is shy and lowly.
Ramakrishna,"When the flower blooms, the bees come uninvited."
May Sarton,"Everything that slows us down and forces patience, everything that sets us back into the slow circles of nature, is a help. Gardening is an instrument of grace."
Doug Larson,A weed is a plant that has mastered every survival skill except for learning how to grow in rows.
Francis Bacon,"God Almighty first planted a garden. And indeed, it is the purest of human pleasures."
Miguel de Cervantes,"For a man to attain to an eminent degree in learning costs him time, watching, hunger, nakedness, dizziness in the head, weakness in the stomach, and other inconveniences."
Ruth Ann Minner,"Our promise to our children should be this: if you do well in school, we will pay for you to obtain a college degree."
G. M. Trevelyan,One half who graduate from college never read another book.
Alexis Herman,"Really, the potential for, first of all, any college graduate today is enormously good. These are good times for anyone with a college degree today, particularly African Americans. With a college degree today, you really breach the unemployment rate."
Jimmy Carter,"In this outward and physical ceremony we attest once again to the inner and spiritual strength of our Nation. As my high school teacher, Miss Julia Coleman, used to say: 'We must adjust to changing times and still hold to unchanging principles.'"
Alan Watts,"I have realized that the past and future are real illusions, that they exist in the present, which is what there is and all there is."
Victor Hugo,There is nothing like a dream to create the future.
Bob Marley,In this bright future you can't forget your past.
Albert Einstein,"The distinction between the past, present and future is only a stubbornly persistent illusion."
Edmund Burke,You can never plan the future by the past.
Dr. Seuss,Only you can control your future.
Jack Welch,Control your own destiny or someone else will.
Warren Bennis,"The factory of the future will have only two employees, a man and a dog. The man will be there to feed the dog. The dog will be there to keep the man from touching the equipment."
Nelson Mandela,"Our human compassion binds us the one to the other - not in pity or patronizingly, but as human beings who have learnt how to turn our common suffering into hope for the future."
Dwight D. Eisenhower,Neither a wise man nor a brave man lies down on the tracks of history to wait for the train of the future to run over him.
Friedrich Nietzsche,The future influences the present just as much as the past.
Neil Armstrong,Here men from the planet Earth first set foot upon the Moon. July 1969 AD. We came in peace for all mankind.
Konrad Adenauer,History is the sum total of things that could have been avoided.
Henry Adams,"Chaos often breeds life, when order breeds habit."
William James,"The world we see that seems so insane is the result of a belief system that is not working. To perceive the world differently, we must be willing to change our belief system, let the past slip away, expand our sense of now, and dissolve the fear in our minds."
Louis D. Brandeis,Most of the things worth doing in the world had been declared impossible before they were done.
William Butler Yeats,Why should we honour those that die upon the field of battle? A man may show as reckless a courage in entering into the abyss of himself.
H. L. Mencken,Legend: A lie that has attained the dignity of age.
Douglas MacArthur,"They died hard, those savage men - like wounded wolves at bay. They were filthy, and they were lousy, and they stunk. And I loved them."
John W. Gardner,History never looks like history when you are living through it.
Gro Harlem Brundtland,Investing in health will produce enormous benefits.
Chanakya,"As long as your body is healthy and under control and death is distant, try to save your soul; when death is immanent what can you do?"
Lucius Annaeus Seneca,The wish for healing has always been half of health.
Courtney Thorne-Smith,"You know, true love really matters, friends really matter, family really matters. Being responsible and disciplined and healthy really matters."
Jackie Mason,It's no longer a question of staying healthy. It's a question of finding a sickness you like.
Mary Baker Eddy,"Health is not a condition of matter, but of Mind."
David Suzuki,"The medical literature tells us that the most effective ways to reduce the risk of heart disease, cancer, stroke, diabetes, Alzheimer's, and many more problems are through healthy diet and exercise. Our bodies have evolved to move, yet we now use the energy in oil instead of muscles to do our work."
Ann Bancroft,I do not think about being beautiful. What I devote most of my time to is being healthy.
Ivan Illich,"Healthy people are those who live in healthy homes on a healthy diet; in an environment equally fit for birth, growth work, healing, and dying... Healthy people need no bureaucratic interference to mate, give birth, share the human condition and die."
Tom Harkin,America's health care system is in crisis precisely because we systematically neglect wellness and prevention.
James Taylor,I find it a lot healthier for me to be someplace where I can go outside in my bare feet.
Steve Yzerman,I'm exhausted trying to stay healthy.
Mike Huckabee,"The health care system is really designed to reward you for being unhealthy. If you are a healthy person and work hard to be healthy, there are no benefits."
Khalil Gibran,"I wash my hands of those who imagine chattering to be knowledge, silence to be ignorance, and affection to be art."
Orison Swett Marden,All men who have achieved great things have been great dreamers.
Emma Goldman,The most unpardonable sin in society is independence of thought.
Corliss Lamont,"True freedom is the capacity for acting according to one's true character, to be altogether one's self, to be self-determined and not subject to outside coercion."
Walter Annenberg,I cannot compromise or inhibit my independence.
Susan B. Anthony,I think the girl who is able to earn her own living and pay her own way should be as happy as anybody on earth. The sense of independence and security is very sweet.
William J. H. Boetcker,You cannot build character and courage by destroying men's initiative and independence.
Sandra Day O'Connor,"It matters enormously to a successful democratic society like ours that we have three branches of government, each with some independence and some control over the other two. That's set out in the Constitution."
Malcolm Turnbull,The most effective check and balance on government has been an independent press which maintains its credibility by ensuring that its criticism is balanced and based on fact - based indeed on solid journalistic work.
Emil Cioran,Jealousy - that jumble of secret worship and ostensible aversion.
Marilyn Manson,"I am drawn to women who are independent and creative, which is problematic because it's a struggle, a competition of careers. There's jealousy."
Helen Rowland,"Jealousy is the tie that binds, and binds, and binds."
Marie de France,"If one of two lovers is loyal, and the other jealous and false, how may their friendship last, for Love is slain!"
Milla Jovovich,"I'm not really easy to live with! There needs to be unlimited patience and unconditional love. Men I've known before loved my independent spirit and were proud of my success, to the point that they'd become jealous of the time I devote to my career."
Clyde Tombaugh,"That's the way I got along in life. I don't ever remember being particularly jealous of anybody, because I figured if I can't do it myself, I don't deserve to get it."
Harriet Ann Jacobs,"I would rather drudge out my life on a cotton plantation, till the grave opened to give me rest, than to live with an unprincipled master and a jealous mistress."
Herodotus,But I like not these great success of yours; for I know how jealous are the gods.
Ambrose Bierce,"Jealous, adj. Unduly concerned about the preservation of that which can be lost only if not worth keeping."
Robert A. Heinlein,A competent and self-confident person is incapable of jealousy in anything. Jealousy is invariably a symptom of neurotic insecurity.
Jeff Foxworthy,I have never been jealous. Not even when my dad finished fifth grade a year before I did.
Solomon Ibn Gabirol,Jealousy is cruel as the grave: the coals thereof are coals of fire.
Lena Horne,Always be smarter than the people who hire you.
Thomas Jefferson,The glow of one warm thought is to me worth more than money.
Thomas A. Edison,"If we did all the things we are capable of, we would literally astound ourselves."
Nathaniel Hawthorne,"Happiness is a butterfly, which when pursued, is always just beyond your grasp, but which, if you will sit down quietly, may alight upon you."
Eleanor Roosevelt,You must do the things you think you cannot do.
Nido Qubein,Your present circumstances don't determine where you can go; they merely determine where you start.
Ella Fitzgerald,"Just don't give up trying to do what you really want to do. Where there is love and inspiration, I don't think you can go wrong."
Sharon Begley,"Somewhere, something incredible is waiting to be known."
William Feather,"Plenty of people miss their share of happiness, not because they never found it, but because they didn't stop to enjoy it."
Julia Roberts,"You know it's love when all you want is that person to be happy, even if you're not part of their happiness."
Ayn Rand,Happiness is that state of consciousness which proceeds from the achievement of one's values.
Jack Kerouac,Great things are not accomplished by those who yield to trends and fads and popular opinion.
John C. Maxwell,The greatest mistake we make is living in constant fear that we will make one.
Saint Augustine,"Do you wish to be great? Then begin by being. Do you desire to construct a vast and lofty fabric? Think first about the foundations of humility. The higher your structure is to be, the deeper must be its foundation."
Mother Teresa,One of the greatest diseases is to be nobody to anybody.
